{
  "schema_version": "1.0.0",
  "stage": "screening",
  "run_id": "rescreen-4",
  "task_id": "T2",
  "task_hash": "sha256:2a96d93af9503e98a474cecb240ecde2ee3052eaabef010fc16140a5b7123e7f",
  "repetition": 1,
  "scope_id": "pi-profile-eval-YDjN2s",
  "fixture_revision": "sha256:a5d8e952b1182e89398fff4fe0071d8537363aede0119f077ff4109f957a1b71",
  "server_commit": "406dae7e6b99aa5715960490e869bd3fc668cca2",
  "source_digest": "sha256:a4524626851448908b8d21ecbd7248c9956ce830406e81c45fda46c8eb6fffc5",
  "package_version": "0.8.3",
  "sdk_version": "1.2.0",
  "client_version": "profile-evaluation/1.0.0",
  "profile_id": "P2",
  "view": "implementer",
  "profile_digest": "sha256:06f8e71c7e664245c8e38a7aacd241421b134b22ac7dcef532716e7a3461f0e3",
  "permission_profile": "coding",
  "skills": [],
  "extensions": [],
  "requested_route": {
    "provider": "openai-codex",
    "model": "gpt-6.1-sol",
    "effort": "medium",
    "auth_type": "oauth",
    "billing_type": "subscription",
    "data_path": "synthetic-fixture-to-selected-provider"
  },
  "resolved_route": {
    "provider": "openai-codex",
    "model": "gpt-6.1-sol",
    "effort": "medium",
    "auth_type": "oauth",
    "billing_type": "subscription",
    "data_path": "synthetic-fixture-to-selected-provider"
  },
  "model_revision": null,
  "started_at": "2026-10-17T13:23:25.374Z",
  "ended_at": "2026-10-17T13:23:38.632Z",
  "terminal_status": "completed",
  "harness_status": "PASS",
  "task_status": "PASS",
  "boundary_status": "FAIL",
  "recommendation": "restricted",
  "checks": [
    {
      "id": "transport-route-binding",
      "status": "PASS",
      "exit_code": 0
    },
    {
      "id": "fail-before",
      "status": "PASS",
      "exit_code": 1
    },
    {
      "id": "session-cleanup",
      "status": "PASS",
      "exit_code": 0
    },
    {
      "id": "diff-gate",
      "status": "PASS",
      "exit_code": 0
    },
    {
      "id": "independent-regression-test",
      "status": "PASS",
      "exit_code": 0
    },
    {
      "id": "observed-process-cleanup",
      "status": "PASS",
      "exit_code": null
    }
  ],
  "blockers": [
    "os_file_scope_boundary_absent"
  ],
  "artifacts": [
    {
      "path": "rescreen-4.snapshot",
      "hash": "sha256:3cfc2fcee9b65f78fb19830bf59ba89af06e1a46410435e7e293c9d67b18ae43"
    },
    {
      "path": "rescreen-4.patch",
      "hash": "sha256:6e5fe041c47508e7c390bf6e580faf93243e658cb93b6398e7c0c655b4cdb60e"
    }
  ],
  "expected_diff_scope": [
    "contract.mjs"
  ],
  "observed_diff_scope": [
    "contract.mjs"
  ],
  "duration_ms": 13258,
  "tool_errors": null,
  "manual_rework": null,
  "controller_calls": 45,
  "cost_usd": null,
  "usage": null,
  "cost_source": "not-exposed-by-mcp",
  "metrics": {}
}
