{
  "schema_version": "1.0.0",
  "stage": "screening",
  "run_id": "rescreen-3",
  "task_id": "T1",
  "task_hash": "sha256:2b8a7d3cfbe985f25a9fe7e2c2e329e90f7c38a16f35ae3e180f1d9cd419531f",
  "repetition": 1,
  "scope_id": "pi-profile-eval-4bpOaQ",
  "fixture_revision": "sha256:579d5064e6529e3a08cbd7f3ecf9636f38ee138d17ee9b89d25fad81b8b69651",
  "server_commit": "406dae7e6b99aa5715960490e869bd3fc668cca2",
  "source_digest": "sha256:a4524626851448908b8d21ecbd7248c9956ce830406e81c45fda46c8eb6fffc5",
  "package_version": "0.8.3",
  "sdk_version": "1.2.0",
  "client_version": "profile-evaluation/1.0.0",
  "profile_id": "P1",
  "view": "scout",
  "profile_digest": "sha256:ad2af9acbecafd9c05ad3cc6399a9d994b9a8ac93fb0286153eea44778bbfc66",
  "permission_profile": "read-only",
  "skills": [],
  "extensions": [],
  "requested_route": {
    "provider": "openai-codex",
    "model": "gpt-6.1-sol",
    "effort": "medium",
    "auth_type": "oauth",
    "billing_type": "subscription",
    "data_path": "synthetic-fixture-to-selected-provider"
  },
  "resolved_route": {
    "provider": "openai-codex",
    "model": "gpt-6.1-sol",
    "effort": "medium",
    "auth_type": "oauth",
    "billing_type": "subscription",
    "data_path": "synthetic-fixture-to-selected-provider"
  },
  "model_revision": null,
  "started_at": "2026-10-17T13:23:13.113Z",
  "ended_at": "2026-10-17T13:23:25.329Z",
  "terminal_status": "completed",
  "harness_status": "PASS",
  "task_status": "PASS",
  "boundary_status": "PASS",
  "recommendation": "restricted",
  "checks": [
    {
      "id": "transport-route-binding",
      "status": "PASS",
      "exit_code": 0
    },
    {
      "id": "session-cleanup",
      "status": "PASS",
      "exit_code": 0
    },
    {
      "id": "diff-gate",
      "status": "PASS",
      "exit_code": 0
    },
    {
      "id": "api-data-flow",
      "status": "PASS",
      "exit_code": 0
    },
    {
      "id": "stale-doc-contradiction",
      "status": "PASS",
      "exit_code": 0
    },
    {
      "id": "observed-process-cleanup",
      "status": "PASS",
      "exit_code": null
    }
  ],
  "blockers": [],
  "artifacts": [],
  "expected_diff_scope": [],
  "observed_diff_scope": [],
  "duration_ms": 12217,
  "tool_errors": null,
  "manual_rework": null,
  "controller_calls": 44,
  "cost_usd": null,
  "usage": null,
  "cost_source": "not-exposed-by-mcp",
  "metrics": {}
}
